title,media,date,datetime,desc,link,img,text,stock,abbrv,title_sent,desc_sent,text_sent,ovr_text_sent_score,ovr_title_sent_score,ovr_desc_sent_score,trifold_score,trifold_rating,text_sent_rating,title_sent_rating,desc_sent_rating
Apple Cuts the Little Guys a Break. Will It Be Enough?,Motley Fool,2 weeks ago,2020-11-19 20:26:12.224813,"Last week, Apple (NASDAQ:AAPL) unveiled a new program that was clearly designed to address the ongoing antitrust criticisms that it is receiving. Dubbed the ...",https://www.fool.com/investing/2020/11/21/apple-cuts-the-little-guys-a-break-will-it-be-enou/,"data:image/gif;base64,R0lGODlhAQABAIAAAP///////yH5BAEKAAEALAAAAAABAAEAAAICTAEAOw==","Last week, Apple (NASDAQ:AAPL) unveiled a new program that was clearly designed to address the ongoing antitrust criticisms that it is receiving. Dubbed the App Store Small Business Program, qualifying developers that earn $1 million in annual revenue or less can enjoy a commission rate of just 15%, or half of the normal 30% cut that the Mac maker takes on digital sales.

Is the move too little, too late?

How the program works

Apple has faced backlash for its standard 30% cut, particularly in the context of small, independent developers that don't make as much money as the richest company on Earth. As long as the developer generated $1 million or less in gross proceeds in the previous calendar year, the developer is eligible for the reduced rate.

The program goes into effect on Jan. 1 of next year, so a developer's 2020 proceeds will determine eligibility for next year. The Cupertino tech juggernaut will use a developer's earnings after deducting Apple's cut to determine the developer's proceeds. As soon as a developer hits $1 million in proceeds, the normal 30% cut will apply ""for the remainder of the year.""

The company says that the new program will help ""the vast majority"" of developers on the App Store, without elaborating or providing specific metrics. Mobile analytics specialist Sensor Tower estimates that the change will affect 98% of developers on the platform, according to The New York Times. However, those small developers represent less than 5% of App Store revenue, so Apple isn't really giving up all that much in terms of absolute dollars.

Playing more defense

The company has spent much of 2020 defending itself from allegations of anticompetitive behavior. Apple backed a study earlier this year that showed that its 30% commission is comparable to other digital platforms such as gaming consoles.

Last month, the House Judiciary Committee released findings following a 16-month investigation. Lawmakers argued that the App Store represents a monopoly on iOS software distribution, and Apple pushed back aggressively on the findings, preferring to define the relevant market as broadly as possible to minimize its market share.

Apple has been making a series of small concessions in an effort to alleviate concerns, such as recently allowing users to change the default apps for certain functions on iOS. The new program is yet another incremental concession intended for the same purpose, but it might not be enough to quell criticisms. In fact, Apple's most vocal critics -- including Spotify and Fortnite maker Epic Games -- are already railing against the change, arguing that the $1 million threshold is arbitrary and creates a new tiered system that developers must now navigate.

It's great that Apple is giving indie devs a better deal, but 95% of in-app purchases are in bigger apps that Apple still taxes at 30%, so this will provide no relief to consumers who are paying inflated prices for items. â€” Tim Sweeney (@TimSweeneyEpic) November 18, 2020

Epic CEO Tim Sweeney pointed out that Apple's higher 30% cut will still apply to most in-app purchases, which theoretically leads to higher prices. That's important because lawmakers and regulators often focus on the ultimate impact on consumers when evaluating allegations of anticompetitive behavior.",apple,aapl,"[{'neg': 0.268, 'neu': 0.732, 'pos': 0.0, 'compound': -0.296}, {'neg': 0.0, 'neu': 1.0, 'pos': 0.0, 'compound': 0.0}]","[{'neg': 0.077, 'neu': 0.813, 'pos': 0.11, 'compound': 0.2023}, {'neg': 0.0, 'neu': 1.0, 'pos': 0.0, 'compound': 0.0}]","[{'neg': 0.077, 'neu': 0.813, 'pos': 0.11, 'compound': 0.2023}, {'neg': 0.0, 'neu': 1.0, 'pos': 0.0, 'compound': 0.0}]",0.10115,-0.148,0.10115,0.018100000000000005,Neutral,Somewhat Positive,Somewhat Negative,Somewhat Positive
Forget Apple. These 5 Stocks Are a Better Bet on New Digital Data Privacy Standards,Motley Fool,2 weeks ago,2020-11-19 20:26:12.227196,"Apple is upending the ad tracking industry. Disruption opens the door for new leaders to take advantage. Nicholas Rossolillo. (TMFnrossolillo). Nov 20, 2020 at ...",https://www.fool.com/investing/2020/11/20/forget-apple-stocks-better-on-digital-data-privacy/,"data:image/gif;base64,R0lGODlhAQABAIAAAP///////yH5BAEKAAEALAAAAAABAAEAAAICTAEAOw==","During its annual Worldwide Developers Conference in June, Apple (NASDAQ:AAPL) management announced a major change was coming: Device users will be prompted to opt into Identity for Advertisers (IDFA) when opening an application. The change is to go into effect in early 2021, buying app developers and advertisers time to adjust -- but the change nonetheless upends a primary (and controversial) way businesses monetize their wares and advertisers track the efficacy of their marketing. Alphabet is expected to follow suit and implement similar changes to its Android mobile operating system.

However, this doesn't mean digital ad tracking is dead. Apple will allow for the collection of data, although device- and user-specific data won't be revealed. The coming changes will also alter behavior at technology firms and alter the way digital content gets monetized.

This could open the door to growth for those players developing viable alternatives to personal data collection and tracking. Five companies doing just that might be worth a look. They are: Magnite (NASDAQ:MGNI), LiveRamp Holdings (NYSE:RAMP), The Trade Desk (NASDAQ:TTD), salesforce.com (NYSE:CRM), and Adobe (NASDAQ:ADBE). Here's why these stocks are a better bet for dealing with new digital data privacy standards.

1. Magnite and 2. LiveRamp: Building new platforms based on publishers, not users

Magnite and LiveRamp are at the forefront of changes to targeted advertising. Both platforms help publishers and advertisers transition away from individual activity tracking to a model that uses an anonymous collection of data. Let's start with Magnite, a supply-side platform (SSP) that is helping publishers scale up their marketing activity using information they themselves are collecting directly from customers.

Magnite CEO Michael Barrett explained that the existing individual identity model is shifting to one powered by publishers themselves, and Magnite is positioned as one of the only SSPs with broad-based publisher relationships and the tools to help them implement more data-friendly practices. In fact, Barrett said on the company's Q3 2020 earnings call that more than 10% of the revenue it generated for publishers was derived from whole audience segments created on Magnite's platform directly, compared to almost none a year ago. The company thinks its sell-side data technology revenue will double again by the end of 2021.

However, as Magnite itself has pointed out, first-party consented targeting (in which the user opts in to tracking) will continue to play a part in this new advertising landscape. That's where LiveRamp comes in. LiveRamp pools first-party anonymized data collected from consumer-facing businesses. The result is a collection of robust consumer data that product and content creators and advertisers can access to make better decisions. Both Magnite and LiveRamp struggled early in the pandemic, as many ad campaigns were temporarily put on hold, but they have since rebounded and continue to forecast double-digit percentage growth through the end of 2020.

3. The Trade Desk: The leading buy-side platform embraces anonymity too

While a sell-side platform helps publishers monetize content, the buy-side of the equation helps those companies looking to market their goods and services find the right outlets (webpages, podcasts, TV spots, etc.) to reach their audience. That's the role that The Trade Desk plays, and its cloud-based platform to help marketers automate and target ideal customers has soared over the last few years.

Besides enjoying general industry migration to digital channels and programmatic targeted ads, The Trade Desk could also benefit from the switch away from identity tracking. The company recently announced a partnership with LiveRamp in which marketers can now bid and transact on LiveRamp's anonymous data-driven platform directly on The Trade Desk. The result is campaign personalization and performance tracking without the need for individual device or app activity tracking.

In the years ahead, adding a new level of user privacy, transparency, and control to its cloud-based marketing tech could help The Trade Desk maintain its fast upward trajectory.

4. Salesforce and 5. Adobe: Helping organizations unlock the power of their data

Software juggernauts Salesforce and Adobe have approached digital transformation from different directions -- the former from its customer relationship management (CRM) software core proficiency, and the latter from its creative software for content and media producers. But both are finding success helping their customers unlock and make full use of their own internal data.

And in a world where privacy and user consent is rightfully getting more attention, unlocking insights on relationships organizations already have with paying customers will only increase in importance. And Salesforce and Adobe are helping in this regard. While their CRM and content creation competencies remain the primary drivers of growth, both have added buy-side marketing to their cloud-based software suites. It's been a valuable add-on for both of them. Organizations are deploying their data within the respective platforms to drive better go-to-market and sales strategies, and use of Salesforce's and Adobe's marketing tools could get a big boost if other device makers follow Apple's lead in eliminating non-consented user tracking.

Apple's first move in removing IDFA won't be the end of the digital data privacy revolution. More changes lie ahead as consumers demand more control over their personal information and activity -- and who's able to utilize it. But in the next stage of transformation, these five companies could benefit from enabling marketers to comply with the coming user-friendlier adjustments.",apple,aapl,"[{'neg': 0.655, 'neu': 0.345, 'pos': 0.0, 'compound': -0.2263}, {'neg': 0.0, 'neu': 0.805, 'pos': 0.195, 'compound': 0.4404}]","[{'neg': 0.0, 'neu': 1.0, 'pos': 0.0, 'compound': 0.0}, {'neg': 0.2, 'neu': 0.64, 'pos': 0.16, 'compound': -0.128}, {'neg': 0.0, 'neu': 1.0, 'pos': 0.0, 'compound': 0.0}, {'neg': 0.0, 'neu': 1.0, 'pos': 0.0, 'compound': 0.0}, {'neg': 0.0, 'neu': 1.0, 'pos': 0.0, 'compound': 0.0}]","[{'neg': 0.0, 'neu': 1.0, 'pos': 0.0, 'compound': 0.0}, {'neg': 0.2, 'neu': 0.64, 'pos': 0.16, 'compound': -0.128}, {'neg': 0.0, 'neu': 1.0, 'pos': 0.0, 'compound': 0.0}, {'neg': 0.0, 'neu': 1.0, 'pos': 0.0, 'compound': 0.0}, {'neg': 0.0, 'neu': 1.0, 'pos': 0.0, 'compound': 0.0}]",-0.0256,0.10705,-0.0256,0.01861666666666667,Neutral,Neutral,Somewhat Positive,Neutral
"Warren Buffett Is Throwing Billions at This Stock. Should You Buy, Too?",Motley Fool,2 weeks ago,2020-11-19 20:26:12.228737,The Motley Fool owns shares of and recommends Apple and Berkshire Hathaway (B shares) and recommends the following options: long January 2021 $200 ...,https://www.fool.com/investing/2020/11/21/warren-buffett-is-throwing-billions-at-this-stock/,"data:image/gif;base64,R0lGODlhAQABAIAAAP///////yH5BAEKAAEALAAAAAABAAEAAAICTAEAOw==","Berkshire Hathaway (NYSE:BRK-B)(NYSE:BRK-A) chairman and CEO Warren Buffett knows a thing or two about investing, to put it mildly. His investment prowess has helped Berkshire stock grow at an average rate of 20% annually between 1965 and 2019, or a total of 2,744,062%. This obliterated the S&P 500 index's return over the same time frame. The popular index rose 19,784% (including reinvested dividends) over this period.

With such a stellar track record, it's worth checking what the Oracle of Omaha's conglomerate is buying the most. Fortunately, Buffett's top stock pick for 2020 is easy to spot, as there's one company's shares he's spending far more money on than anything else: Berkshire Hathaway itself. The company is repurchasing its own shares in droves, signaling to investors that Buffett thinks Berkshire stock is undervalued.

Buffett just bought $9 billion more of this stock

In a filing with the Securities and Exchange Commission released earlier this month, Berkshire Hathaway revealed it bought an incredible $9 billion of its own stock during Q3 -- more than the company has ever spent buying back the stock in any single year.

Buffett's move to spend billions buying back Berkshire shares extends the famed investor's growing bullishness on the stock. The company has been steadily increasing its buybacks recently. In the first and second quarter of 2020, Berkshire repurchases amounted to $1.7 billion and $5.1 billion, respectively.

For context on just how aggressive Buffett's recent repurchases of Berkshire stock are, note that the company spent only $4.9 billion repurchasing shares in 2019. Even more, Berkshire is now spending more money buying back its own stock than any other publicly traded company, barring Apple (NASDAQ:AAPL). Of course, the tech company has a market capitalization four times the size of Berkshire and is raking in $73 billion of free cash annually, so it's pretty easy for the iPhone maker to spend more than Berkshire.

Should you buy, too?

When Buffett is buying back Berkshire stock aggressively, it means he thinks shares are undervalued relative to their long-term prospects. Unlike some companies that implement a share repurchase program without considering what the stock price is trading at the time, Buffett and his investment partner Charlie Munger only buy back the stock when they think they're getting a good deal.

""If the price-to-value discount (as we estimate it) widens, we will likely become more aggressive in purchasing shares,"" Buffett said in Berkshire's most recent annual letter to shareholders. ""We will not, however, prop the stock at any level.""

Buffett emphasized in the same shareholder letter that he is not interested in buying back the stock at a slight discount. The price needs to be meaningfully undervalued before Berkshire acts. ""Calculations of intrinsic value are far from precise,"" the CEO explained. ""Consequently, neither [Charlie or myself feel] any urgency to buy an estimated $1 of value for a very real 95 cents.""

With Buffett buying record amounts of Berkshire stock, he's likely exceptionally bullish on the company's shares right now.

Of course, investors shouldn't buy Berkshire stock only because Buffett is an aggressive buyer; they should take the time to do their own due diligence. Still, Buffett seems to be onto something. Based on the stock's conservative valuation of 20 times free cash flow and the quality of the company's underlying assets -- from its $113 billion stake in Apple to its massive insurance business -- Berkshire stock does look like a great investment opportunity for investors willing hold shares for the long haul.",apple,aapl,"[{'neg': 0.0, 'neu': 1.0, 'pos': 0.0, 'compound': 0.0}, {'neg': 0.0, 'neu': 1.0, 'pos': 0.0, 'compound': 0.0}]","[{'neg': 0.096, 'neu': 0.631, 'pos': 0.272, 'compound': 0.5106}]","[{'neg': 0.096, 'neu': 0.631, 'pos': 0.272, 'compound': 0.5106}]",0.5106,0.0,0.5106,0.34040000000000004,Positive,Positive,Neutral,Positive
Microsoft's Growth Engine is Firing on All Cylinders,Motley Fool,2 weeks ago,2020-11-19 20:26:12.230211,"But Apple's big growth opportunity, is services. How much do you guys think services was up for Apple in the most recent quarter? Brian Feroldi: 5%. Tim Beyers: ...",https://www.fool.com/investing/2020/11/21/microsofts-growth-engine-is-firing-on-all-cylinder/,"data:image/gif;base64,R0lGODlhAQABAIAAAP///////yH5BAEKAAEALAAAAAABAAEAAAICTAEAOw==","Microsoft (NASDAQ:MSFT) is a company reborn. Only a few years ago, the software giant was facing an uncertain future. Its formerly dominant operating system business was steadily losing relevance as modern computing moved away from the PC and into mobile, an area the company had never established a foothold in.

Fast forward to today, and Microsoft is back in the game. It's grown its market value to more than $1.6 trillion at recent prices.

On the Nov. 2 edition of ""The Wrap"" on Motley Fool Live, Motley Fool analyst Tim Beyers walked ""The Wrap"" host Jason Hall and Motley Fool contributor Brian Feroldi through Microsoft's latest results, pointing out just how well the company is executing.

Tim Beyers: Right. Microsoft had its first quarter earnings report and this was last week. Let me just pull this up here because I want to pull up their release. But I think it was very strong and I think the thing that it gets glossed over, but it shouldn't, is that among the ones that are here domestically in the U.S. That's talking AWS, Microsoft Azure, and I don't know. Some people say Azure, I say Azure. I don't know. Abiomed.

Tim Beyers: BioMed, I have no idea. But here's a thing, of the three, Google Cloud, Azure, and AWS, who is the fastest-growing? Who continues to be the fastest-growing? Azure and they did it again. Let me just show this here.

Jason Hall: Wait. You mean Azure?

Tim Beyers: Yeah. There you go. Exactly right.

Brian Feroldi: Azure.

Tim Beyers: Yes or whatever. Do we even know? I don't know. So overall, Microsoft Azure was up 45% year-over-year. But here's the thing I want to show just in general. If you take a look across all the products, remember that this is a company that's well over a trillion dollars in market cap. This is growing very quickly. I just want to show some basic products and how fast these are growing. Server products up 21% in constant currency. Xbox content and services up 30% same year-over-year. Microsoft Surface, their hardware product in constant currency up 36% year-over-year.

Windows is -- granted -- you want to talk Windows and Windows OEM, installing Window machines that ship from somebody else, like Microsoft has a deal with say like Dell, and then Dell puts Windows on their machines and then they ship out those machines. So Microsoft gets some licensing fees. That used to be the biggest part of their business, down 5% year-over-year. That is largely, except for Bing, search advertising, everything else, except Office commercial products is double-digit growth. That is astounding.

Let me give you some perspective on this. So overall, in the latest quarter, Apple, killer business. We all know Apple is a great business. But Apple's big growth opportunity, is services. How much do you guys think services was up for Apple in the most recent quarter?

Brian Feroldi: 5%.

Tim Beyers: About 16%. It's definitely growth. Look at all these products. That's like basically matching LinkedIn, which Microsoft's like, ""Yeah. We got this thing."" My point here is that, Microsoft is really killing it. They're really killing it and I think that is underappreciated about how this company has structured a portfolio of products that has been very attractive for the customer base that's very sticky and they have this two layers. They have the Office products and the Windows products that provide an annuity cash flow stream, that Microsoft has proven really adept at reinvesting into high-growth opportunities, like Azure and they're killing it. I continue to believe that even though I say of the two, between Amazon and Microsoft, because if you split up Amazon today, and you split out AWS, I think Amazon would be a more valuable company. But in terms of business quality, I do not believe there is a better business in the world right now than Microsoft. Full stop.

Jason Hall: That's a powerful statement.

Tim Beyers: Full stop.

Jason Hall: That is a powerful statement.",apple,aapl,"[{'neg': 0.218, 'neu': 0.545, 'pos': 0.236, 'compound': 0.0516}]","[{'neg': 0.0, 'neu': 0.413, 'pos': 0.587, 'compound': 0.7964}, {'neg': 0.0, 'neu': 1.0, 'pos': 0.0, 'compound': 0.0}, {'neg': 0.0, 'neu': 1.0, 'pos': 0.0, 'compound': 0.0}, {'neg': 0.0, 'neu': 1.0, 'pos': 0.0, 'compound': 0.0}]","[{'neg': 0.0, 'neu': 0.413, 'pos': 0.587, 'compound': 0.7964}, {'neg': 0.0, 'neu': 1.0, 'pos': 0.0, 'compound': 0.0}, {'neg': 0.0, 'neu': 1.0, 'pos': 0.0, 'compound': 0.0}, {'neg': 0.0, 'neu': 1.0, 'pos': 0.0, 'compound': 0.0}]",0.1991,0.0516,0.1991,0.14993333333333334,Somewhat Positive,Somewhat Positive,Neutral,Somewhat Positive
