title,media,date,datetime,desc,link,img,text,stock,abbrv,title_sent,desc_sent,text_sent,ovr_text_sent_score,ovr_title_sent_score,ovr_desc_sent_score,trifold_score,trifold_rating,text_sent_rating,title_sent_rating,desc_sent_rating
Microsoft's Growth Engine is Firing on All Cylinders,Motley Fool,2 weeks ago,2020-11-19 20:26:12.858049,"But Apple's big growth opportunity, is services. How much do you guys think services was up for Apple in the most recent quarter? Brian Feroldi: 5%. Tim Beyers: ...",https://www.fool.com/investing/2020/11/21/microsofts-growth-engine-is-firing-on-all-cylinder/,"data:image/gif;base64,R0lGODlhAQABAIAAAP///////yH5BAEKAAEALAAAAAABAAEAAAICTAEAOw==","Microsoft (NASDAQ:MSFT) is a company reborn. Only a few years ago, the software giant was facing an uncertain future. Its formerly dominant operating system business was steadily losing relevance as modern computing moved away from the PC and into mobile, an area the company had never established a foothold in.

Fast forward to today, and Microsoft is back in the game. It's grown its market value to more than $1.6 trillion at recent prices.

On the Nov. 2 edition of ""The Wrap"" on Motley Fool Live, Motley Fool analyst Tim Beyers walked ""The Wrap"" host Jason Hall and Motley Fool contributor Brian Feroldi through Microsoft's latest results, pointing out just how well the company is executing.

Tim Beyers: Right. Microsoft had its first quarter earnings report and this was last week. Let me just pull this up here because I want to pull up their release. But I think it was very strong and I think the thing that it gets glossed over, but it shouldn't, is that among the ones that are here domestically in the U.S. That's talking AWS, Microsoft Azure, and I don't know. Some people say Azure, I say Azure. I don't know. Abiomed.

Tim Beyers: BioMed, I have no idea. But here's a thing, of the three, Google Cloud, Azure, and AWS, who is the fastest-growing? Who continues to be the fastest-growing? Azure and they did it again. Let me just show this here.

Jason Hall: Wait. You mean Azure?

Tim Beyers: Yeah. There you go. Exactly right.

Brian Feroldi: Azure.

Tim Beyers: Yes or whatever. Do we even know? I don't know. So overall, Microsoft Azure was up 45% year-over-year. But here's the thing I want to show just in general. If you take a look across all the products, remember that this is a company that's well over a trillion dollars in market cap. This is growing very quickly. I just want to show some basic products and how fast these are growing. Server products up 21% in constant currency. Xbox content and services up 30% same year-over-year. Microsoft Surface, their hardware product in constant currency up 36% year-over-year.

Windows is -- granted -- you want to talk Windows and Windows OEM, installing Window machines that ship from somebody else, like Microsoft has a deal with say like Dell, and then Dell puts Windows on their machines and then they ship out those machines. So Microsoft gets some licensing fees. That used to be the biggest part of their business, down 5% year-over-year. That is largely, except for Bing, search advertising, everything else, except Office commercial products is double-digit growth. That is astounding.

Let me give you some perspective on this. So overall, in the latest quarter, Apple, killer business. We all know Apple is a great business. But Apple's big growth opportunity, is services. How much do you guys think services was up for Apple in the most recent quarter?

Brian Feroldi: 5%.

Tim Beyers: About 16%. It's definitely growth. Look at all these products. That's like basically matching LinkedIn, which Microsoft's like, ""Yeah. We got this thing."" My point here is that, Microsoft is really killing it. They're really killing it and I think that is underappreciated about how this company has structured a portfolio of products that has been very attractive for the customer base that's very sticky and they have this two layers. They have the Office products and the Windows products that provide an annuity cash flow stream, that Microsoft has proven really adept at reinvesting into high-growth opportunities, like Azure and they're killing it. I continue to believe that even though I say of the two, between Amazon and Microsoft, because if you split up Amazon today, and you split out AWS, I think Amazon would be a more valuable company. But in terms of business quality, I do not believe there is a better business in the world right now than Microsoft. Full stop.

Jason Hall: That's a powerful statement.

Tim Beyers: Full stop.

Jason Hall: That is a powerful statement.",apple,aapl,"[{'neg': 0.218, 'neu': 0.545, 'pos': 0.236, 'compound': 0.0516}]","[{'neg': 0.0, 'neu': 0.413, 'pos': 0.587, 'compound': 0.7964}, {'neg': 0.0, 'neu': 1.0, 'pos': 0.0, 'compound': 0.0}, {'neg': 0.0, 'neu': 1.0, 'pos': 0.0, 'compound': 0.0}, {'neg': 0.0, 'neu': 1.0, 'pos': 0.0, 'compound': 0.0}]","[{'neg': 0.0, 'neu': 0.413, 'pos': 0.587, 'compound': 0.7964}, {'neg': 0.0, 'neu': 1.0, 'pos': 0.0, 'compound': 0.0}, {'neg': 0.0, 'neu': 1.0, 'pos': 0.0, 'compound': 0.0}, {'neg': 0.0, 'neu': 1.0, 'pos': 0.0, 'compound': 0.0}]",0.1991,0.0516,0.1991,0.14993333333333334,Somewhat Positive,Somewhat Positive,Neutral,Somewhat Positive
Will Retail REITs Struggle or Thrive in 2021?,Motley Fool,2 weeks ago,2020-11-19 20:26:12.863477,"Apple, 6.5%, so Apple is three times bigger than all the REITs in the S&P 500. I'm not saying that's wrong, but I think there's room for REITs to go higher from ...",https://www.fool.com/investing/2020/11/21/will-retail-reits-struggle-or-thrive-in-2021/,"data:image/gif;base64,R0lGODlhAQABAIAAAP///////yH5BAEKAAEALAAAAAABAAEAAAICTAEAOw==","Retail real estate has been one of the hardest-hit subsectors in 2020. The industry was already in the midst of a transition due to the growth of e-commerce before a pandemic brutalized the economy, and proved the final nail in the coffin for many retailers. While the S&P 500 has bounced back and delivered 13% in total returns since the beginning of the year, on strong gains by the tech sector, the S&P 1500 Retail REITs Index is still down more than 30%.

But the question many investors want answered is this: Is the worst behind us, or will retail REITs continue to struggle? On the Nov. 2 edition of ""The Wrap"" on Motley Fool Live, host Jason Hall engaged Motley Fool contributor Brian Feroldi and Motley Fool analyst Tim Beyers to answer this exact question. And while all three think the worst is, broadly speaking, probably over, they have some differences in their expectations going forward.

Transcript:

Jason Hall: Pennsylvania Real Estate Trust (NYSE:PEI). I have to confess, this is one that I bought some of before, this was back in January or February. This is the largest mall owner in Philadelphia. It just filed for bankruptcy. Brian Feroldi, I'm going to get you to go first here. I want you to tell me, will retail REIT stocks, so these are the companies that own the property, will they finish 2021 higher or lower?

Brian Feroldi: Than they are right now, I assume.

Jason Hall: Than they are right now, and why.

Brian Feroldi: Higher, they're higher. They will finish higher because by the end of 2021, we will have a vaccine, good malls will attract back people, bad malls will die, as they should, or be converted into other usable space, but I think the devaluations are so compressed on these things. I'm going to pull it up while Tim's talking, but I'm pretty sure that REITs make up 2% of the S&P 500 right now, it's somewhere around there, two percent. Apple, 6.5%, so Apple is three times bigger than all the REITs in the S&P 500. I'm not saying that's wrong, but I think there's room for REITs to go higher from here, especially over the next year plus.

Jason Hall: Tim Beyers, what do you say?

Tim Beyers: I agree with that for a different reason. I'm just going to slightly modify what Brian said because he's right in that I believe it's a small portion of the market right now, and what you said about things being repurposed, I think that's the key. I don't think the malls come back in the same way, but I believe that there's so much movement in e-commerce and movement toward logistics and flexible workspace and things like that that there's a lot of repurposed property, these fixed malls [...] reimagined as distribution centers, as all sorts of stuff that I think we can creatively reengage that space, and I think we will.

So I expect it to be higher once we start reimagining. For example, I'll just say that I would find it fascinating but also not at all surprising if Amazon goes shopping in the mall space and starts figuring out like, we're going to have a distribution center here, here, here. They got a lot of cash, they have a lot of cash flow, I could absolutely see them doing that and maybe even just tying it close to where they have all those Kohl's. You go and you drop off your return at Kohl's, get that near an Amazon distribution center, you're just optimizing, optimizing, optimizing and, man, there's nobody better than Amazon at that. So I'm going to say higher for the repurposing.

Jason Hall: I agree. I think at this point the baby's been thrown out with the bathwater. I think the idea that the mall is going to completely go away is just as false as every piece of commercial real estate in Manhattan is going to be useless. I think that there's a lot of really extreme assumptions that are getting factored into a lot of things, so I tend to agree. I think, to both Tim and Brian's point, whether it's still serving the same purpose, that's definitely up for discussion. I think, in general, a lot of it is going to get repurposed.

I think the best companies out there that are owning large malls are in the best positions to negotiate with an Amazon. If you're Amazon, you want to talk to somebody that owns 300, 500 malls because then you can pick the 50 or 100 that best fit your need versus Pennsylvania Real Estate Trust that just owns malls in a very small geographically located area that don't give them access to the markets that they need. So it's going to be really interesting to see how it plays, but I tend to agree. I'll go so far as to say not only will they be higher, I think they're going to outperform the S&P 500 over the next two years, five years, maybe even the next 10 years. I think there's a lot of opportunity.",apple,aapl,"[{'neg': 0.247, 'neu': 0.753, 'pos': 0.0, 'compound': -0.3182}]","[{'neg': 0.0, 'neu': 1.0, 'pos': 0.0, 'compound': 0.0}, {'neg': 0.0, 'neu': 0.9, 'pos': 0.1, 'compound': 0.1967}]","[{'neg': 0.0, 'neu': 1.0, 'pos': 0.0, 'compound': 0.0}, {'neg': 0.0, 'neu': 0.9, 'pos': 0.1, 'compound': 0.1967}]",0.09835,-0.3182,0.09835,-0.040499999999999994,Neutral,Somewhat Positive,Negative,Somewhat Positive
Podcast: The Marvelous MacBook Air M1,Yahoo Tech,2 weeks ago,2020-11-19 20:26:30.637947,"Apple's new M1-equipped MacBook Air is a doozy of an ultraportable. This week, Devindra and Cherlynn chat about what makes it so special, and what it means ...",https://finance.yahoo.com/news/engadget-podcast-macbook-air-m1-133054462.html,"data:image/gif;base64,R0lGODlhAQABAIAAAP///////yH5BAEKAAEALAAAAAABAAEAAAICTAEAOw==","TipRanks

Investors know that the key to profits is in the return â€“ and that means, a willingness to shoulder risk. Risk is relative, of course, and tends to run hand-in-hand with the return potential. Find a stock with a giant return potential, and chances are, youâ€™ve also found one with a higher risk profile. The highest returns usually come along with the lowest share prices. After all, when a stock is priced for just pennies, even a small gain in share price translates into a huge return. Which means that penny stocks â€“ these days, usually seen as those equities priced under $5 â€“ combine a perfect storm of market attractions: low share price, high return potential, and higher than usual risk. Using the TipRanks database, weâ€™ve pulled up details on three compelling stocks that fit this profile of low share price and huge upside potential, 100% or more, according to Wall Street analysts. Cinedigm Corporation (CIDM)Weâ€™ll start with Cinedigm, the LA-based entertainment company specializing in content marketing and distribution along with digital cinema. Cinedigm is an independent studio for film, TV, and digital production. The company distributes digital media across a variety of content networks.Back in June, CIDM shares showed a sharp spike when the company announced its partnership with Vewd, the worldâ€™s largest OTT software provider for Smart TVs, a growing segment of the digital viewing world. Customers are shifting away from cable TV and more and more toward streaming. A working relationship with a Smart TV software company would give Cinedigm access to Vewdâ€™s installed customer base â€“ more than 300 million Smart TV sets. Revenues in 2020 have been fairly stable. For Q1, Q2, and Q3, the top line came in at $7.74 million, $6.02 million, and $7.18 million. The Q3 number holds the middle spot in that range. Earnings, however, missed expectations. At a 23-cent per share loss, the EPS came in 17-cents below expectations. On a positive note, CIDM reported a year-over-year sales increase in its core business of ad-based video on demand of 27%.Covering the stock for Benchmark, 5-star analyst Daniel Kurnos points out a few reasons why he thinks Cinedigm ""is becoming a much more intriguing investment proposition, particularly at these levels: 1) Organic growth is still building, with the legacy channel lineup strategy on pace to achieve the 30 channel milestone 12 months ahead of schedule; 2) A new highly accretive, streaming roll-up strategy is emerging that Cinedigm is in the best position to execute with minimal competition; 3) No credence or value is being given any more to Cinedigmâ€™s digital projector inventory or Starrise stake, both of which should ultimately benefit in a post-COVID world.""In line with his bullish stance, Kurnos rates CIDM a Buy, and his $3.50 price target implies room for a stunning 573% upside potential in the next 12 months. (To watch Kurnosâ€™s track record, click here)Currently, CIDM has 2 reviews on record, making the stock a Moderate Buy. The shares are selling for 53 cents, and the $2.75 average price target suggests an impressive 418% upside on the one-year time horizon. (See CIDM stock analysis on TipRanks)Kubient (KBNT)Content distribution relies heavily on marketing and monetization for its profits, and thatâ€™s where Kubient comes in. This cloud software company offers an ad platform that connects publishers and marketing directly with their audiences. The company works with audience automation to collect data, connect brands, and create a transparent ad environment across digital channels.Kubient is a new company in the stock market, having held its IPO just this past August. The initial offering brought in $12.5 million gross, selling 2.5 million shares at $5 each. During those first few months of public trading, which included the end of the calendar third quarter, Kubient reported some solid Q3 revenue results. The top line rose from $92,000 in Q3 to $280,000. The year-over-year gain was even more impressive, reaching 400%.Maxim analyst Jack Vander Aarde believes that Kubient holds a strong position to bring real changes to its industry. The 5-star analyst writes of the companyâ€™s potential, â€œKBNTâ€™s core offering, Audience Cloud, seeks to disrupt the $325B+ digital advertising market and address the industryâ€™s current pain points. In 2019, advertisers lost ~$42B to ad fraud, which is forecast to grow into a $100B problem by 2023, but Kubient has a potential game-changing solution called KAI [...] We project 2021 revenue of $6.6M, up 211% y/y, and 2022 revenue of $17.4M, up 164% y/y. The business is highly scalable and should unlock significant operating leverage as revenue grows.â€To this end, Vander Aarde rates KBNT a Buy along with a $10 price target. This figure suggests 154% upside growth from the current share price of $4. (To watch Vander Aardeâ€™s track record, click here)Orion Group Holdings (ORN)The construction industry brings to mind home construction and hard hats putting up high rises, and thatâ€™s the usual experience most of us have. But Orion Group Holdings occupies a specialty niche in the industry, focusing on civil marine construction, industry, and commercial concrete. The company owns subsidiaries that each concentrate on a different niche, allowing them to hone their skills in some vital â€“ even if less recognized â€“ sectors of the construction world.The companyâ€™s share price through this year shows both its resilience and the importance of the construction industry to the economy. ORN shares fell sharply in mid-winter, when the coronavirus hit hard at the economy by forcing lockdown policies â€“ but it has regained ground as the economy has reopened, and has recouped more than half of its losses from that time. Overall, however, ORN is still down ~20% year-to-date.Orionâ€™s quarterly fiscal results also show the tale. The company registered a sequential loss in Q1, but has shown gains since then. For the calendar third quarter, ORN reported $189 million at the top line. EPS has performed even better this year, beating the forecast in Q1 when a loss was expected and the actual result was an 8-cent per share profit â€“ and spiking to 23 cents per share, or 187% above the forecast, in Q3.In a positive development heading into the end of the year, in November Orionâ€™s concrete segment won three major contracts in Texas. The projects are located in the Houston area, and total some $52 million.Noble analyst Poe Fratt feels that this stock has room for growth, and promises returns for investors. He writes, â€œ[We] believe that the current stock price doesn't fairly reflect the ISG restructuring improvements and the positive outlook. A combination of above-average backlog, improved profitability, lower financial leverage and attractive valuation of 2.8x 2020E EBITDA and 2.4x 2021E EBITDA supports our view that the risk/reward profile remains compelling.â€Frattâ€™s $8.25 price target implies a 101% upside for the year ahead. He rates the stock as Outperform (i.e. Buy). (To watch Frattâ€™s track record, click here)The two recent Buy ratings on ORN make the analyst consensus view a Moderate Buy. The average price target of $8.13 suggests a 100% growth potential for the next year. Shares are currently selling for $4.08. (See ORN stock analysis on TipRanks)To find good ideas for penny stocks trading at attractive valuations, visit TipRanksâ€™ Best Stocks to Buy, a newly launched tool that unites all of TipRanksâ€™ equity insights.Disclaimer: The opinions expressed in this article are solely those of the featured analysts. The content is intended to be used for informational purposes only. It is very important to do your own analysis before making any investment.",apple,aapl,"[{'neg': 0.0, 'neu': 0.562, 'pos': 0.438, 'compound': 0.5994}]","[{'neg': 0.0, 'neu': 1.0, 'pos': 0.0, 'compound': 0.0}, {'neg': 0.0, 'neu': 0.821, 'pos': 0.179, 'compound': 0.541}]","[{'neg': 0.0, 'neu': 1.0, 'pos': 0.0, 'compound': 0.0}, {'neg': 0.0, 'neu': 0.821, 'pos': 0.179, 'compound': 0.541}]",0.2705,0.5994,0.2705,0.3801333333333334,Positive,Somewhat Positive,Positive,Somewhat Positive
